{
  "version": 1,
  "provenance": "synthetic-fixtures",
  "documents": [
    {
      "key": "asset-001",
      "title": "Low Poly Fantasy Sword and Shield",
      "description": "Hand-painted low poly fantasy sword and buckler shield set. Optimized for mobile and indie RPG games with clean UV layout and diffuse texture.",
      "category": "3D Models",
      "tags": ["fantasy", "lowpoly", "sword", "shield", "weapon", "rpg"]
    },
    {
      "key": "asset-002",
      "title": "Низькополігональний лицарський меч",
      "description": "Стилізована 3D модель лицарського дворучного меча. Оптимізована сітка для мобільних ігор та стратегій, ручна текстура.",
      "category": "3D Models",
      "tags": ["меч", "зброя", "фентезі", "lowpoly", "лицар", "3d"]
    },
    {
      "key": "asset-003",
      "title": "Sci-Fi Plasma Blaster Rifle",
      "description": "Futuristic energy assault rifle model with 4K PBR textures, emissive glow maps, and modular attachments. Rigged and ready for animation.",
      "category": "3D Models",
      "tags": ["scifi", "weapon", "gun", "rifle", "plasma", "pbr", "fps"]
    },
    {
      "key": "asset-004",
      "title": "Плазмова гвинтівка майбутнього",
      "description": "Футуристична лазерна гвинтівка для шутерів від першої особи. Текстури PBR 4K, емісійні карти світіння, формат FBX.",
      "category": "3D Models",
      "tags": ["зброя", "гвинтівка", "scifi", "плазма", "шутер", "модель"]
    },
    {
      "key": "asset-005",
      "title": "Medieval Stone Castle Modular Kit",
      "description": "Modular stone castle kit including walls, towers, gates, battlements, and stairs. PBR materials with normal, roughness, and ambient occlusion.",
      "category": "3D Models",
      "tags": ["modular", "medieval", "castle", "architecture", "stone", "environment"]
    },
    {
      "key": "asset-006",
      "title": "Модульний середньовічний замок",
      "description": "Набір модульних кам'яних стін, веж та брам для побудови фортець у середньовічному сетингу. Сумісний з сіткою припасування.",
      "category": "3D Models",
      "tags": ["замок", "модульний", "середньовіччя", "архітектура", "камінь"]
    },
    {
      "key": "asset-007",
      "title": "Stylized Pine Forest Vegetation Pack",
      "description": "Stylized pine trees, firs, bushes, rocks, and ground clutter. Features custom wind shader vertex colors and multiple LOD levels.",
      "category": "3D Models",
      "tags": ["nature", "trees", "forest", "stylized", "foliage", "vegetation"]
    },
    {
      "key": "asset-008",
      "title": "Стилізований сосновий ліс та рослинність",
      "description": "Комплект стилізованих дерев сосни, ялинок, кущів та моху для відкритих природних локацій. Оптимізовані рівні деталізації LOD.",
      "category": "3D Models",
      "tags": ["ліс", "дерева", "природа", "стилізований", "рослини", "локація"]
    },
    {
      "key": "asset-009",
      "title": "Cyberpunk Street Props and Holograms",
      "description": "Collection of neon signs, holographic advertisements, vending machines, dumpsters, and street lights for futuristic cityscapes.",
      "category": "3D Models",
      "tags": ["cyberpunk", "props", "neon", "hologram", "city", "scifi"]
    },
    {
      "key": "asset-010",
      "title": "Кіберпанк неонові вивіски та вуличні об'єкти",
      "description": "Реквізит для нічного футуристичного міста: голограми, термінали, неонове підсвічування та міські декорації.",
      "category": "3D Models",
      "tags": ["кіберпанк", "неон", "місто", "голограма", "декорації"]
    },
    {
      "key": "asset-011",
      "title": "PBR Cobblestone and Wet Mud Textures",
      "description": "Seamless tileable PBR texture set containing albedo, normal, height, roughness, and ambient occlusion maps at 4096x4096 resolution.",
      "category": "Textures & Materials",
      "tags": ["pbr", "textures", "stone", "cobblestone", "mud", "seamless", "4k"]
    },
    {
      "key": "asset-012",
      "title": "Безшовні текстури бруківки та вологої землі",
      "description": "Набір безшовних PBR текстур кам'яної мостової та мокрої землі. Роздільна здатність 4K, карти нормалей, шорсткості та висоти.",
      "category": "Textures & Materials",
      "tags": ["текстури", "бруківка", "земля", "pbr", "безшовні", "матеріали"]
    },
    {
      "key": "asset-013",
      "title": "Sci-Fi Metal Hull Panels PBR Pack",
      "description": "Industrial spaceship metal panels with rivets, seams, and ventilation grates. Includes clean and weathered rust variations.",
      "category": "Textures & Materials",
      "tags": ["pbr", "scifi", "metal", "hull", "panel", "spaceship", "industrial"]
    },
    {
      "key": "asset-014",
      "title": "Металеві панелі космічного корабля PBR",
      "description": "Текстури обшивки космольоту з болтами та стиками. Варіанти чистого металу та зношеного металу з іржею.",
      "category": "Textures & Materials",
      "tags": ["метал", "космос", "панелі", "іржа", "текстури", "pbr"]
    },
    {
      "key": "asset-015",
      "title": "Stylized Hand-Painted Wood Planks",
      "description": "Vibrant hand-painted wooden floor and wall plank textures for whimsical, fantasy, and adventure game environments.",
      "category": "Textures & Materials",
      "tags": ["wood", "stylized", "handpainted", "planks", "floor", "fantasy"]
    },
    {
      "key": "asset-016",
      "title": "Стилізовані мальовані дерев'яні дошки",
      "description": "Текстури дощок та дерев'яної підлоги ручної роботи у казковому мультяшному стилі для ізометричних та платформерних ігор.",
      "category": "Textures & Materials",
      "tags": ["дерево", "дошки", "мальовані", "стилізовані", "підлога"]
    },
    {
      "key": "asset-017",
      "title": "Epic Orchestral Battle Music Pack",
      "description": "High-energy orchestral soundtrack with brass fanfares, booming percussion, and soaring strings. Includes 8 loopable tracks and stinger cues.",
      "category": "Audio & Music",
      "tags": ["music", "orchestral", "battle", "epic", "soundtrack", "loop"]
    },
    {
      "key": "asset-018",
      "title": "Епічна оркестрова бойова музика",
      "description": "Саундтрек для динамічних битв з живими барабанами, духовими інструментами та струнною секцією. Безшовні лупи та кінцівки треків.",
      "category": "Audio & Music",
      "tags": ["музика", "саундтрек", "оркестр", "битва", "епічна", "аудіо"]
    },
    {
      "key": "asset-019",
      "title": "Retro 8-Bit Chiptune Arcade Soundtrack",
      "description": "Authentic chiptune music created with classic soundchips. Perfect for retro platformers, arcade shooters, and 2D pixel games.",
      "category": "Audio & Music",
      "tags": ["chiptune", "retro", "8bit", "arcade", "pixel", "soundtrack", "synth"]
    },
    {
      "key": "asset-020",
      "title": "Ретро 8-бітний чіптюн саундтрек для аркад",
      "description": "Ностальгічні мелодії в стилі NES та GameBoy для піксельних платформерів. 10 аудіодоріжок у форматі WAV та OGG.",
      "category": "Audio & Music",
      "tags": ["чіптюн", "8біт", "ретро", "музика", "піксель", "аркада"]
    },
    {
      "key": "asset-021",
      "title": "Carpathian Ambient Nature and Wind Sounds",
      "description": "Immersive field recordings from mountain forests: rustling leaves, bird calls, gentle rain, and howling mountain breeze. 96kHz 24-bit.",
      "category": "Audio & Music",
      "tags": ["ambient", "nature", "forest", "wind", "rain", "soundfx", "foley"]
    },
    {
      "key": "asset-022",
      "title": "Звуки карпатського лісу та гірського вітру",
      "description": "Автентичні польові аудіозаписи дикої природи: шум гірського вітру, спів птахів, шелест лісу та дзюркіт струмка.",
      "category": "Audio & Music",
      "tags": ["звуки", "природа", "ліс", "карпати", "вітер", "ембієнт", "фолей"]
    },
    {
      "key": "asset-023",
      "title": "Sci-Fi Laser and Plasma Sound Effects",
      "description": "Over 120 sound effects for energy blasters, charging beams, forcefields, reload power-ups, and futuristic explosions.",
      "category": "Audio & Music",
      "tags": ["sfx", "scifi", "laser", "plasma", "weapons", "soundeffects", "blaster"]
    },
    {
      "key": "asset-024",
      "title": "Звукові ефекти лазерів та бластерів",
      "description": "Колекція з понад сотні футуристичних аудіоефектів пострілів бластера, заряджання батареї та активації силового поля.",
      "category": "Audio & Music",
      "tags": ["звуки", "ефекти", "лазер", "бластер", "scifi", "постріли"]
    },
    {
      "key": "asset-025",
      "title": "Modern Dark HUD UI Kit",
      "description": "Clean vector user interface package featuring health bars, minimap frames, action slots, buttons, dialog boxes, and tooltips in SVG and PNG.",
      "category": "UI & 2D Assets",
      "tags": ["ui", "hud", "interface", "vector", "dark", "minimap", "gui"]
    },
    {
      "key": "asset-026",
      "title": "Темний мінімалістичний ігровий інтерфейс HUD",
      "description": "Векторний комплект UI елементів: шкали здоров'я, рамки міні-карти, панелі інвентарю, кнопки та модальні вікна.",
      "category": "UI & 2D Assets",
      "tags": ["інтерфейс", "ui", "hud", "вектор", "кнопки", "панелі", "графіка"]
    },
    {
      "key": "asset-027",
      "title": "Fantasy RPG Inventory and Spell Icons",
      "description": "250 hand-drawn 512x512 icons of potions, weapons, armors, rings, scrolls, and elemental magic spell runes.",
      "category": "UI & 2D Assets",
      "tags": ["icons", "rpg", "inventory", "spells", "magic", "fantasy", "2d"]
    },
    {
      "key": "asset-028",
      "title": "Іконки інвентарю та магічних заклять для RPG",
      "description": "Мальовані кольорові іконки зілля, артефактів, броні, сувоїв та магічних стихій для рольових ігор.",
      "category": "UI & 2D Assets",
      "tags": ["іконки", "інвентар", "магія", "rpg", "зілля", "фентезі", "2d"]
    },
    {